quote_text,author,tags,likes
"7 Effective Ways to Make Others Feel Important

1. Use their name.
2. Express sincere gratitude.
3. Do more listening than talking.
4. Talk more about them than about you.
5. Be authentically interested.
6. Be sincere in your praise.
7. Show you care.","Roy T. Bennett,","['care', 'gratitude', 'inspiration', 'inspirational', 'inspirational-attitude', 'inspirational-life', 'inspirational-quotes', 'inspire', 'inspiring', 'leader', 'leadership', 'life', 'life-and-living', 'life-lessons', 'life-quotes', 'listening', 'living', 'motivation', 'motivational', 'optimism', 'optimistic', 'positive', 'positive-affirmation', 'positive-life', 'positive-thinking', 'respect', 'show-you-care']",0
"My past has not defined me, destroyed me, deterred me, or defeated me; it has only strengthened me.","Steve Maraboli,","['defeat', 'define', 'happiness', 'inspirational', 'life', 'motivational', 'past', 'strengthen', 'success']",0
"Don't wait for the right moment to start, start and make each moment right.","Roy T. Bennett,","['inspiration', 'inspirational', 'inspirational-attitude', 'inspirational-life', 'inspirational-quote', 'inspirational-quotes', 'inspire', 'inspiring', 'life', 'life-and-living', 'life-lessons', 'life-philosophy', 'life-quotes', 'living', 'motivation', 'motivational', 'optimism', 'optimistic', 'positive', 'positive-affirmation', 'positive-life', 'positive-thinking', 'start-up']",0
"One resolution I have made, and try always to keep, is this: ‘To rise above little things’.",John Burroughs,"['character', 'hope', 'motivational']",0
"Plant seeds of happiness, hope, success, and love; it will all come back to you in abundance. This is the law of nature.","Steve Maraboli,","['abundance', 'action', 'choice', 'happiness', 'hope', 'inspirational', 'love', 'motivational', 'nature', 'success']",0
Good people see the good and bring out the best in other people.,"Roy T. Bennett,","['goodness', 'inspiration', 'inspirational', 'inspirational-attitude', 'inspirational-life', 'inspirational-quotes', 'inspire', 'inspiring', 'leader', 'leadership', 'life', 'life-and-living', 'life-lessons', 'life-quotes', 'living', 'motivation', 'motivational', 'optimism', 'optimistic', 'positive', 'positive-affirmation', 'positive-life', 'positive-thinking']",0
"Make the most of the best and the best of the worst, and keep your standards high. Never settle for anything less than you deserve or are capable of achieving.","Roy T. Bennett,","['inspiration', 'inspirational', 'inspirational-attitude', 'inspirational-life', 'inspirational-quotes', 'inspire', 'inspiring', 'life', 'life-and-living', 'life-lessons', 'life-quotes', 'living', 'motivation', 'motivational', 'optimism', 'optimistic', 'positive', 'positive-affirmation', 'positive-life', 'positive-thinking']",0
Gratitude builds a bridge to abundance.,"Roy T. Bennett,","['inspiration', 'inspirational', 'inspirational-attitude', 'inspirational-life', 'inspirational-quotes', 'inspire', 'inspiring', 'life', 'life-and-living', 'life-lessons', 'life-quotes', 'living', 'motivation', 'motivational', 'optimism', 'optimistic', 'positive', 'positive-affirmation', 'positive-life', 'positive-thinking']",0
Beliefs are choices. First you choose your beliefs. Then your beliefs affect your choices.,Roy T. Bennett,"['belief', 'beliefs', 'believe', 'choice', 'choices', 'inspiration', 'inspirational', 'inspirational-quotes', 'inspire', 'inspiring', 'life', 'life-quotes', 'living', 'motivation', 'motivational', 'optimism', 'optimistic', 'positive', 'positive-affirmation', 'positive-life', 'positive-thinking']",0
"Perfectly Imperfect

We have all heard that no two snowflakes are alike. Each snowflake takes the perfect form for the maximum efficiency and effectiveness for its journey. And while the universal force of gravity gives them a shared destination, the expansive space in the air gives each snowflake the opportunity to take their own path. They are on the same journey, but each takes a different path.
Along this gravity-driven journey, some snowflakes collide and damage each other, some collide and join together, some are influenced by wind... there are so many transitions and changes that take place along the journey of the snowflake. But, no matter what the transition, the snowflake always finds itself perfectly shaped for its journey.
I find parallels in nature to be a beautiful reflection of grand orchestration. One of these parallels is of snowflakes and us. We, too, are all headed in the same direction. We are being driven by a universal force to the same destination. We are all individuals taking different journeys and along our journey, we sometimes bump into each other, we cross paths, we become altered... we take different physical forms. But at all times we too are 100% perfectly imperfect. At every given moment we are absolutely perfect for what is required for our journey. I’m not perfect for your journey and you’re not perfect for my journey, but I’m perfect for my journey and you’re perfect for your journey. We’re heading to the same place, we’re taking different routes, but we’re both exactly perfect the way we are.
Think of what understanding this great orchestration could mean for relationships. Imagine interacting with others knowing that they too each share this parallel with the snowflake. Like you, they are headed to the same place and no matter what they may appear like to you, they have taken the perfect form for their journey. How strong our relationships would be if we could see and respect that we are all perfectly imperfect for our journey.","Steve Maraboli,","['imperfection', 'inspirational', 'journey', 'life', 'motivational', 'perfection', 'relationships', 'snowflakes']",0
You are essentially who you create yourself to be and all that occurs in your life is the result of your own making.,"Stephen Richards,","['initiative', 'mind-power', 'motivational', 'new-thought', 'positive-thinking', 'self-help', 'wealth', 'worthy']",0
"The reason many people in our society are miserable, sick, and highly stressed is because of an unhealthy attachment to things they have no control over.","Steve Maraboli,","['attachment', 'control', 'life', 'miserable', 'motivational', 'people', 'sick', 'stressed', 'unhealthy']",0
Life is short. Focus on what really matters most. You have to change your priorities over time.,"Roy T. Bennett,","['inspiration', 'inspirational', 'inspirational-attitude', 'inspirational-life', 'inspirational-quote', 'inspirational-quotes', 'inspire', 'inspiring', 'life', 'life-and-living', 'life-lessons', 'life-philosophy', 'life-quotes', 'living', 'motivation', 'motivational', 'optimism', 'optimistic', 'positive', 'positive-affirmation', 'positive-life', 'positive-thinking', 'time']",0
"People who lack the clarity, courage, or determination to follow their own dreams will often find ways to discourage yours. When you change for the better, the people around you will be inspired to change also....but only after doing their best to make you stop. Live your truth and don't EVER stop.","Steve Maraboli,","['action', 'change', 'determination', 'empowerment', 'inspirational', 'life', 'motivational', 'success']",0
"LAW 46
Never Appear Too Perfect

Appearing better than others is always dangerous, but most dangerous of all is to appear to have no faults or weaknesses. Envy creates silent enemies. It is smart to occasionally display defects, and admit to harmless vices, in order to deflect envy and appear more human and approachable. Only gods and the dead can seem perfect with impunity.","Robert Greene,","['dicta', 'motivational']",0
"It doesn't matter if a million people tell you what you can't do, or if ten million tell you no. If you get one yes from God that's all you need.",Tyler Perry,"['god', 'inspirational', 'motivational']",0
"Change may not always bring growth, but there is no growth without change.","Roy T. Bennett,","['change', 'growth', 'inspiration', 'inspirational', 'inspirational-attitude', 'inspirational-life', 'inspirational-quotes', 'inspire', 'inspiring', 'life', 'life-and-living', 'life-lessons', 'life-quotes', 'living', 'motivation', 'motivational', 'optimism', 'optimistic', 'positive', 'positive-affirmation', 'positive-life', 'positive-thinking']",0
"Surround Yourself with Positive People Who Believe in Your Dreams

Distance yourself from negative people who try to lower your motivation and decrease your ambition. Create space for positive people to come into your life.

Surround yourself with positive people who believe in your dreams, encourage your ideas, support your ambitions, and bring out the best in you.","Roy T. Bennett,","['ambition', 'dreams', 'inspiration', 'inspirational', 'inspirational-attitude', 'inspirational-life', 'inspirational-quotes', 'inspire', 'inspiring', 'life', 'life-and-living', 'life-lessons', 'life-quotes', 'living', 'motivation', 'motivational', 'optimism', 'optimistic', 'positive', 'positive-affirmation', 'positive-life', 'positive-thinking']",0
Great leaders can see the greatness in others when they can’t see it themselves and lead them to their highest potential they don’t even know.,"Roy T. Bennett,","['greatness', 'inspiration', 'inspirational', 'inspirational-attitude', 'inspirational-life', 'inspirational-quotes', 'inspire', 'inspiring', 'leaders', 'leadership', 'life', 'life-and-living', 'life-lessons', 'life-quotes', 'living', 'motivation', 'motivational', 'optimism', 'optimistic', 'positive', 'positive-affirmation', 'positive-life', 'positive-thinking', 'potential']",0
"When you take control of your attitude, you take control of your life.","Roy T. Bennett,","['attitude', 'inspiration', 'inspirational', 'inspirational-attitude', 'inspirational-life', 'inspirational-quotes', 'inspire', 'inspiring', 'life', 'life-and-living', 'life-lessons', 'life-quotes', 'living', 'motivation', 'motivational', 'optimism', 'optimistic', 'positive', 'positive-affirmation', 'positive-life', 'positive-thinking']",0
"Always believe in yourself and always stretch yourself beyond your limits. Your life is worth a lot more than you think because you are capable of accomplishing more than you know. You have more potential than you think, but you will never know your full potential unless you keep challenging yourself and pushing beyond your own self imposed limits.","Roy T. Bennett,","['accomplishment', 'challenge', 'inspiration', 'inspirational', 'inspirational-attitude', 'inspirational-life', 'inspirational-quotes', 'inspire', 'inspiring', 'life', 'life-and-living', 'life-lessons', 'life-quotes', 'living', 'motivation', 'motivational', 'optimism', 'optimistic', 'positive', 'positive-affirmation', 'positive-life', 'positive-thinking', 'potential']",0
"I promise you nothing is as chaotic as it seems. Nothing is worth diminishing your health. Nothing is worth poisoning yourself into stress, anxiety, and fear.","Steve Maraboli,","['anxiety', 'fear', 'health', 'inspirational', 'motivational', 'poison', 'stress']",0
"To learn something new, you need to try new things and not be afraid to be wrong.",Roy T. Bennett,"['fearless', 'inspiration', 'inspirational', 'inspirational-attitude', 'inspirational-life', 'inspirational-quotes', 'inspire', 'inspiring', 'learning', 'life', 'life-and-living', 'life-lessons', 'life-quotes', 'living', 'motivation', 'motivational', 'optimism', 'optimistic', 'positive', 'positive-affirmation', 'positive-life', 'positive-thinking', 'trying']",0
The right thing to do and the hard thing to do are usually the same.,"Steve Maraboli,","['accountability', 'doing-right', 'life', 'motivational', 'responsibility']",0
Stop doing what is easy or popular. Start doing what is right.,"Roy T. Bennett,","['act', 'action', 'do', 'doing', 'inspiration', 'inspirational', 'inspirational-attitude', 'inspirational-life', 'inspirational-quotes', 'inspire', 'inspiring', 'life', 'life-and-living', 'life-lessons', 'life-quotes', 'living', 'motivation', 'motivational', 'optimism', 'optimistic', 'positive', 'positive-affirmation', 'positive-life', 'positive-thinking', 'right', 'start', 'startup', 'truth', 'what-is-easy', 'what-is-popular', 'what-is-right']",0
"LAW 25
Re-Create Yourself

Do not accept the roles that society foists on you. Re-create yourself by forging a new identity, one that commands attention and never bores the audience. Be the master of your own image rather than letting others define if for you. Incorporate dramatic devices into your public gestures and actions – your power will be enhanced and your character will seem larger than life.","Robert Greene,","['dicta', 'inspirational', 'motivational']",0
One of the best ways to influence people is to make them feel important.,Roy T. Bennett,"['influence', 'inspiration', 'inspirational', 'inspirational-quotes', 'inspire', 'inspiring', 'leader', 'leaders', 'leadership', 'life', 'life-quotes', 'living', 'motivation', 'motivational']",0
"Enthusiasm can help you find the new doors, but it takes passion to open them. If you have a strong purpose in life, you don't have to be pushed. Your passion will drive you there.","Roy T. Bennett,","['authentic-living', 'conviction', 'enthusiasm', 'inspiration', 'inspirational', 'inspirational-quotes', 'life', 'life-quotes', 'living-on-purpose', 'motivation', 'motivational', 'opportunity', 'optimism', 'optimistic', 'passion', 'positive', 'positive-affirmation']",0
Let go of something old that no longer serves you in order to make room for something new.,"Roy T. Bennett,","['inspiration', 'inspirational', 'inspirational-attitude', 'inspirational-life', 'inspirational-quotes', 'inspire', 'inspiring', 'letting-go', 'life', 'life-and-living', 'life-lessons', 'life-quotes', 'living', 'motivation', 'motivational', 'optimism', 'optimistic', 'positive', 'positive-affirmation', 'positive-life', 'positive-thinking']",0
"The comfort zone is a psychological state in which one feels familiar, safe, at ease, and secure. You never change your life until you step out of your comfort zone; change begins at the end of your comfort zone.",Roy T. Bennett,"['change', 'comfort-zone', 'inspiration', 'inspirational', 'inspirational-attitude', 'inspirational-life', 'inspirational-quotes', 'inspire', 'inspiring', 'life', 'life-and-living', 'life-lessons', 'life-quotes', 'living', 'motivation', 'motivational', 'optimism', 'optimistic', 'positive', 'positive-affirmation', 'positive-life', 'positive-thinking']",0
"You are not a victim. No matter what you have been through, you're still here. You may have been challenged, hurt, betrayed, beaten, and discouraged, but nothing has defeated you. You are still here! You have been delayed but not denied. You are not a victim, you are a victor. You have a history of victory.","Steve Maraboli,","['beaten', 'betrayed', 'challenged', 'defeated', 'denied', 'destiny', 'discouraged', 'history', 'hurt', 'inspirational', 'motivational', 'victim']",0
"I cannot compromise my respect for your love. You can keep your love, I will keep my respect.","Amit Kalantri,","['breaking-up', 'breakup', 'breakups', 'compromise', 'human', 'humans', 'inspiration', 'inspirational', 'inspirational-quotes', 'love', 'motivation', 'motivational', 'motivational-quotes', 'philosophy', 'respect', 'respectable', 'respected', 'respectful', 'respecting', 'respecting-others', 'respecting-yourself', 'self-respect', 'wisdom', 'wisdom-quotes']",0
Consistency is the true foundation of trust. Either keep your promises or do not make them.,Roy T. Bennett,"['consistency', 'inspiration', 'inspirational', 'inspirational-quotes', 'inspire', 'inspiring', 'keep-your-promises', 'leader', 'leaders', 'leadership', 'life', 'life-quotes', 'living', 'motivation', 'motivational', 'optimism', 'optimistic', 'positive', 'positive-affirmation', 'positive-life', 'positive-thinking', 'trust']",0
Everything is hard before it is easy,Goethe J.W.,['motivational'],0
"It's funny how, in this journey of life, even though we may begin at different times and places, our paths cross with others so that we may share our love, compassion, observations, and hope. This is a design of God that I appreciate and cherish.","Steve Maraboli,","['appreciation', 'compassion', 'god', 'hope', 'inspirational', 'journey', 'life', 'motivational', 'observation']",0
Shine your light and make a positive impact on the world; there is nothing so honorable as helping improve the lives of others.,Roy T. Bennett,"['inspiration', 'inspirational', 'inspirational-quotes', 'inspire', 'inspiring', 'leader', 'leaders', 'leadership', 'life', 'life-quotes', 'light', 'living', 'motivation', 'motivational', 'optimism', 'optimistic', 'positive', 'positive-affirmation', 'positive-life', 'positive-thinking', 'shine', 'shine-your-light']",0
"Dream your own dreams, achieve your own goals. Your journey is your own and unique.","Roy T. Bennett,","['dream', 'dreams', 'goals', 'inspiration', 'inspirational', 'inspirational-attitude', 'inspirational-life', 'inspirational-quotes', 'inspire', 'inspiring', 'life', 'life-and-living', 'life-lessons', 'life-quotes', 'living', 'motivation', 'motivational', 'optimism', 'optimistic', 'positive', 'positive-affirmation', 'positive-life', 'positive-thinking']",0
The discontent and frustration that you feel is entirely your own creation.,"Stephen Richards,","['law-of-attraction', 'mind-power', 'money', 'motivational', 'new-age', 'positive-thinking', 'self-help', 'stephen-richards', 'wealth', 'worthy']",0
"Fear robs you of your freedom to make the right choice in life that can bridge the gap between where you are and where you want to be. On the other side of fear, lies freedom. If you want to grow, you need to be brave and take risks. If you're not uncomfortable, you're not growing.","Roy T. Bennett,","['fearless', 'growth', 'inspiration', 'inspirational', 'inspirational-attitude', 'inspirational-life', 'inspirational-quote', 'inspirational-quotes', 'inspire', 'inspiring', 'life', 'life-and-living', 'life-lessons', 'life-philosophy', 'life-quotes', 'living', 'motivation', 'motivational', 'optimism', 'optimistic', 'positive', 'positive-affirmation', 'positive-life', 'positive-thinking']",0
"Great Leaders Create More Leaders

Good leaders have vision and inspire others to help them turn vision into reality. Great leaders create more leaders, not followers. Great leaders have vision, share vision, and inspire others to create their own.","Roy T. Bennett,","['inspiration', 'inspirational', 'inspirational-attitude', 'inspirational-life', 'inspirational-quotes', 'inspire', 'inspiring', 'leader', 'leadership', 'life', 'life-and-living', 'life-lessons', 'life-quotes', 'living', 'motivation', 'motivational', 'optimism', 'optimistic', 'positive', 'positive-affirmation', 'positive-life', 'positive-thinking', 'success', 'vision']",0
Be with someone who inspires you and makes you be the best version of yourself.,Roy T. Bennett,"['inspiration', 'inspirational', 'inspirational-attitude', 'inspirational-life', 'inspirational-quote', 'inspirational-quotes', 'inspire', 'inspiring', 'life', 'life-and-living', 'life-lessons', 'life-philosophy', 'life-quotes', 'living', 'motivation', 'motivational', 'optimism', 'optimistic', 'positive', 'positive-affirmation', 'positive-life', 'positive-thinking', 'relationship']",0
The greatest step towards a life of simplicity is to learn to let go.,"Steve Maraboli,","['inspirational', 'letting-go', 'life', 'motivational', 'simplicity']",0
Life teaches us the right path is rarely the easy one.,"Roy T. Bennett,","['inspiration', 'inspirational', 'inspirational-attitude', 'inspirational-life', 'inspirational-quotes', 'inspire', 'inspiring', 'life', 'life-and-living', 'life-lessons', 'life-quotes', 'living', 'motivation', 'motivational', 'optimism', 'optimistic', 'positive', 'positive-affirmation', 'positive-life', 'positive-thinking']",0
"The harder you fall, the heavier your heart; the heavier your heart, the stronger you climb; the stronger you climb, the higher your pedestal.","Criss Jami,","['accomplishment', 'achievement', 'adversity', 'anger', 'climbing', 'encouragement', 'falling', 'heart', 'inspirational', 'motivational', 'perseverance', 'persistence', 'strength', 'success', 'try-again']",0
"Find a purpose to serve, not a lifestyle to live.","Criss Jami,","['achieve', 'achievement', 'achieving', 'ambition', 'goals', 'inspiration', 'inspirational', 'inspire', 'inspiring', 'life', 'lifestyle', 'living', 'meaning', 'motivate', 'motivating', 'motivation', 'motivational', 'purpose', 'purpose-in-life', 'reason', 'reason-to-breathe', 'reason-to-live', 'sacrifice', 'success', 'successful-living']",0
Keep in mind that the true measure of an individual is how he treats a person who can do him absolutely no good.,Ann Landers,"['character', 'motivational']",0
"Every choice comes with a consequence. Once you make a choice, you must accept responsibility. You cannot escape the consequences of your choices, whether you like them or not.","Roy T. Bennett,","['choices', 'inspiration', 'inspirational', 'inspirational-attitude', 'inspirational-life', 'inspirational-quotes', 'inspire', 'inspiring', 'life', 'life-and-living', 'life-lessons', 'life-quotes', 'living', 'motivation', 'motivational', 'optimism', 'optimistic', 'positive', 'positive-affirmation', 'positive-life', 'positive-thinking']",0
Failures are the stairs we climb to reach success.,"Roy T. Bennett,","['failure', 'inspiration', 'inspirational', 'inspirational-attitude', 'inspirational-life', 'inspirational-quotes', 'inspire', 'inspiring', 'life', 'life-and-living', 'life-lessons', 'life-quotes', 'living', 'motivation', 'motivational', 'optimism', 'optimistic', 'positive', 'positive-affirmation', 'positive-life', 'positive-thinking', 'success']",0
No one has ever achieved greatness without dreams.,"Roy T. Bennett,","['dream', 'dreams', 'greatness', 'inspiration', 'inspirational', 'inspirational-attitude', 'inspirational-life', 'inspirational-quotes', 'inspire', 'inspiring', 'life', 'life-and-living', 'life-lessons', 'life-quotes', 'living', 'motivation', 'motivational', 'optimism', 'optimistic', 'positive', 'positive-affirmation', 'positive-life', 'positive-thinking']",0
Live boldly. Push yourself. Don't settle.,"Jojo Moyes,","['inspirational', 'motivational']",0
You can have everything you want if you can put your heart and soul into everything you do.,Roy T. Bennett,"['doing', 'energy', 'heart', 'inspiration', 'inspirational', 'inspirational-quotes', 'inspire', 'inspiring', 'life', 'life-quotes', 'living', 'motivation', 'motivational', 'optimism', 'optimistic', 'positive', 'positive-affirmation', 'positive-life', 'positive-thinking', 'soul']",0
Free yourself from the complexities and drama of your life. Simplify. Look within. Within ourselves we all have the gifts and talents we need to fulfill the purpose we've been blessed with.,"Steve Maraboli,","['blessings', 'drama', 'empowerment', 'gratitude', 'inspirational', 'life', 'motivational', 'purpose', 'simplify']",0
"After sleeping through a hundred million centuries we have finally opened our eyes on a sumptuous planet, sparkling with color, bountiful with life. Within decades we must close our eyes again. Isn’t it a noble, an enlightened way of spending our brief time in the sun, to work at understanding the universe and how we have come to wake up in it? This is how I answer when I am asked—as I am surprisingly often—why I bother to get up in the mornings.",Richard Dawkins,"['beauty', 'color', 'enlightened', 'inspirational', 'meaning', 'motivational', 'questions', 'sleep']",0
"Difficulties and adversities viciously force all their might on us and cause us to fall apart, but they are necessary elements of individual growth and reveal our true potential. We have got to endure and overcome them, and move forward. Never lose hope. Storms make people stronger and never last forever.","Roy T. Bennett,","['adversity', 'challenge', 'growth', 'hope', 'inspiration', 'inspirational', 'inspirational-quotes', 'inspire', 'inspiring', 'life', 'life-quotes', 'living', 'motivation', 'motivational', 'never-lose-hope', 'optimism', 'optimistic', 'positive', 'positive-affirmation', 'positive-life', 'positive-thinking', 'potential']",0
How much you can learn when you fail determines how far you will go into achieving your goals.,"Roy T. Bennett,","['failure', 'inspiration', 'inspirational', 'inspirational-attitude', 'inspirational-life', 'inspirational-quotes', 'inspire', 'inspiring', 'learning', 'life', 'life-and-living', 'life-lessons', 'life-quotes', 'living', 'motivation', 'motivational', 'optimism', 'optimistic', 'positive', 'positive-affirmation', 'positive-life', 'positive-thinking', 'success']",0
"Stay strong, stay positive, and never give up.","Roy T. Bennett,","['being-positive', 'inspiration', 'inspirational', 'inspirational-quotes', 'life', 'life-quotes', 'motivation', 'motivational', 'never-give-up', 'never-giving-up', 'optimism', 'optimistic', 'positive', 'positive-affirmation', 'positive-life', 'positive-thinking', 'strong']",0
Today is a new day. Don't let your history interfere with your destiny! Let today be the day you stop being a victim of your circumstances and start taking action towards the life you want. You have the power and the time to shape your life. Break free from the poisonous victim mentality and embrace the truth of your greatness. You were not meant for a mundane or mediocre life!,Steve Maraboli,"['action', 'circumstances', 'destiny', 'greatness', 'history', 'inspirational', 'life', 'mediocre', 'motivational', 'mundane', 'new-day', 'power', 'shape', 'today', 'truth', 'victim', 'victim-mentality']",0
