quote_text,author,tags,likes
I must not fear. Fear is the mind-killer. Fear is the little-death that brings total obliteration. I will face my fear. I will permit it to pass over me and through me. And when it has gone past I will turn the inner eye to see its path. Where the fear has gone there will be nothing. Only I will remain.,"Frank Herbert,","['bene-gesserit', 'fear', 'litany-against-fear', 'motivational', 'scifi']",0
Attitude is a choice. Happiness is a choice. Optimism is a choice. Kindness is a choice. Giving is a choice. Respect is a choice. Whatever choice you make makes you. Choose wisely.,"Roy T. Bennett,","['attitude', 'choice', 'giving', 'happiness', 'inspirational', 'kindness', 'life-and-living', 'life-lessons', 'motivational', 'positive-affirmation']",0
Don't be pushed around by the fears in your mind. Be led by the dreams in your heart.,"Roy T. Bennett,","['dreams', 'fearless', 'heart', 'inspiration', 'inspirational', 'inspirational-attitude', 'inspirational-life', 'inspirational-quotes', 'inspire', 'inspiring', 'life', 'life-and-living', 'life-lessons', 'life-quotes', 'living', 'mind', 'motivation', 'motivational', 'optimism', 'optimistic', 'positive', 'positive-affirmation', 'positive-life', 'positive-thinking']",0
"Believe in yourself. You are braver than you think, more talented than you know, and capable of more than you imagine.","Roy T. Bennett,","['achievement', 'believe-in-yourself', 'brave', 'courage', 'inspiration', 'inspirational', 'inspirational-attitude', 'inspirational-life', 'inspirational-quotes', 'inspire', 'inspiring', 'life', 'life-and-living', 'life-lessons', 'life-quotes', 'living', 'motivation', 'motivational', 'optimism', 'optimistic', 'positive', 'positive-affirmation', 'positive-life', 'positive-thinking', 'talent']",0
Live the Life of Your Dreams: Be brave enough to live the life of your dreams according to your vision and purpose instead of the expectations and opinions of others.,"Roy T. Bennett,","['brave', 'courage', 'dreams', 'inspiration', 'inspirational', 'inspirational-attitude', 'inspirational-life', 'inspirational-quotes', 'inspire', 'inspiring', 'life', 'life-and-living', 'life-lessons', 'life-quotes', 'living', 'motivation', 'motivational', 'optimism', 'optimistic', 'positive', 'positive-affirmation', 'positive-life', 'positive-thinking', 'purpose', 'vision']",0
"It’s only after you’ve stepped outside your comfort zone that you begin to change, grow, and transform.",Roy T. Bennett,"['change', 'focus', 'grow', 'growth', 'inspiration', 'inspirational', 'inspirational-quotes', 'inspire', 'inspiring', 'leader', 'leaders', 'leadership', 'life', 'life-quotes', 'living', 'motivation', 'motivational', 'optimism', 'optimistic', 'positive', 'positive-affirmation', 'positive-life', 'positive-thinking', 'stay-focused', 'step-out-of-comfort-zone', 'transform']",0
"The truth is, unless you let go, unless you forgive yourself, unless you forgive the situation, unless you realize that the situation is over, you cannot move forward.","Steve Maraboli,","['forgiveness', 'inspirational', 'letting-go', 'life', 'motivational', 'moving-forward', 'truth']",0
"Do what is right, not what is easy nor what is popular.","Roy T. Bennett,","['inspirational', 'integrity', 'motivational', 'what-is-right']",0
"Success is not how high you have climbed, but how you make a positive difference to the world.","Roy T. Bennett,","['inspiration', 'inspirational', 'inspirational-attitude', 'inspirational-life', 'inspirational-quotes', 'inspire', 'inspiring', 'leader', 'leadership', 'life', 'life-and-living', 'life-lessons', 'life-quotes', 'living', 'motivation', 'motivational', 'optimism', 'optimistic', 'positive', 'positive-affirmation', 'positive-life', 'positive-thinking', 'success']",0
"Pursue what catches your heart, not what catches your eyes.","Roy T. Bennett,","['gratitude', 'heart', 'inspiration', 'inspirational', 'inspirational-attitude', 'inspirational-life', 'inspirational-quotes', 'inspire', 'inspiring', 'life', 'life-and-living', 'life-lessons', 'life-quotes', 'living', 'motivation', 'motivational', 'optimism', 'optimistic', 'positive', 'positive-affirmation', 'positive-life', 'positive-thinking', 'thoughts']",0
"Dare to Be

When a new day begins, dare to smile gratefully.

When there is darkness, dare to be the first to shine a light.

When there is injustice, dare to be the first to condemn it.

When something seems difficult, dare to do it anyway.

When life seems to beat you down, dare to fight back.

When there seems to be no hope, dare to find some.

When you’re feeling tired, dare to keep going.

When times are tough, dare to be tougher.

When love hurts you, dare to love again.

When someone is hurting, dare to help them heal.

When another is lost, dare to help them find the way.

When a friend falls, dare to be the first to extend a hand.

When you cross paths with another, dare to make them smile.

When you feel great, dare to help someone else feel great too.

When the day has ended, dare to feel as you’ve done your best.

Dare to be the best you can –

At all times, Dare to be!","Steve Maraboli,","['compassion', 'dare-to-be', 'gratitude', 'inspirational', 'life', 'motivational', 'seize-the-day', 'smile', 'success']",0
Start each day with a positive thought and a grateful heart.,"Roy T. Bennett,","['gratitude', 'heart', 'inspiration', 'inspirational', 'inspirational-attitude', 'inspirational-life', 'inspirational-quotes', 'inspire', 'inspiring', 'life', 'life-and-living', 'life-lessons', 'life-quotes', 'living', 'motivation', 'motivational', 'optimism', 'optimistic', 'positive', 'positive-affirmation', 'positive-life', 'positive-thinking', 'thoughts']",0
"Everything can be taken from a man but one thing: the last of the human freedoms—to choose one’s attitude in any given set of circumstances, to choose one’s own way.","Viktor E. Frankl,","['inspirational', 'motivational']",0
"Be grateful for what you already have while you pursue your goals.
If you aren’t grateful for what you already have, what makes you think you would be happy with more.","Roy T. Bennett,","['goal', 'goals', 'gratitude', 'happiness', 'inspiration', 'inspirational', 'inspirational-attitude', 'inspirational-life', 'inspirational-quotes', 'inspire', 'inspiring', 'leader', 'leadership', 'life', 'life-and-living', 'life-lessons', 'life-quotes', 'living', 'motivation', 'motivational', 'optimism', 'optimistic', 'positive', 'positive-affirmation', 'positive-life', 'positive-thinking']",0
"Life is about accepting the challenges along the way, choosing to keep moving forward, and savoring the journey.","Roy T. Bennett,","['challenge', 'enjoy-the-journey', 'inspiration', 'inspirational', 'inspirational-attitude', 'inspirational-life', 'inspirational-quotes', 'inspire', 'inspiring', 'keep-moving-forward', 'life', 'life-and-living', 'life-lessons', 'life-quotes', 'living', 'motivation', 'motivational', 'move-on', 'optimism', 'optimistic', 'positive', 'positive-affirmation', 'positive-life', 'positive-thinking']",0
Be brave to stand for what you believe in even if you stand alone.,"Roy T. Bennett,","['belief', 'beliefs', 'believe', 'courage', 'courage-quotes', 'inspiration', 'inspirational', 'inspirational-quotes', 'inspire', 'inspiring', 'life', 'life-quotes', 'living', 'motivation', 'motivational', 'optimism', 'optimistic', 'positive', 'positive-affirmation', 'positive-life', 'positive-thinking']",0
"Letting go means to come to the realization that some people are a part of your history, but not a part of your destiny.",Steve Maraboli,"['destiny', 'happiness', 'history', 'inspirational', 'let-go', 'letting-go', 'life', 'motivational', 'moving-on', 'success']",0
Never lose hope. Storms make people stronger and never last forever.,"Roy T. Bennett,","['adversity', 'difficulty', 'hope', 'inspiration', 'inspirational', 'inspirational-attitude', 'inspirational-life', 'inspirational-quotes', 'inspire', 'inspiring', 'life', 'life-and-living', 'life-lessons', 'life-quotes', 'living', 'motivation', 'motivational', 'optimism', 'optimistic', 'perseverance', 'persistence', 'positive', 'positive-affirmation', 'positive-life', 'positive-thinking', 'storms']",0
Do not fear failure but rather fear not trying.,"Roy T. Bennett,","['failure', 'fearless', 'inspiration', 'inspirational', 'inspirational-attitude', 'inspirational-life', 'inspirational-quote', 'inspirational-quotes', 'inspire', 'inspiring', 'life', 'life-and-living', 'life-lessons', 'life-philosophy', 'life-quotes', 'living', 'motivation', 'motivational', 'never-give-up', 'optimism', 'optimistic', 'persistence', 'positive', 'positive-affirmation', 'positive-life', 'positive-thinking', 'trying']",0
"Lack of direction, not lack of time, is the problem. We all have twenty-four hour days.",Zig Ziglar,"['attention', 'direction', 'focus', 'inspirational', 'motivational']",0
Cry. Forgive. Learn. Move on. Let your tears water the seeds of your future happiness.,Steve Maraboli,"['cry', 'forgive', 'happiness', 'inspiration', 'learn', 'letting-go', 'life', 'motivational', 'moving-on', 'seeds', 'success', 'tears', 'water']",0
You never change your life until you step out of your comfort zone; change begins at the end of your comfort zone.,Roy T. Bennett,"['achievement', 'change', 'comfort-zone', 'courage', 'dream', 'dreams', 'inspiration', 'inspirational', 'inspirational-quotes', 'inspire', 'inspiring', 'leader', 'leaders', 'leadership', 'life', 'life-quotes', 'living', 'motivation', 'motivational', 'start-up', 'step-out-of-your-comfort-zone']",0
"Do not let the memories of your past limit the potential of your future. There are no limits to what you can achieve on your journey through life, except in your mind.","Roy T. Bennett,","['future', 'inspiration', 'inspirational', 'inspirational-attitude', 'inspirational-life', 'inspirational-quotes', 'inspire', 'inspiring', 'life', 'life-and-living', 'life-lessons', 'life-quotes', 'limit', 'living', 'motivation', 'motivational', 'optimism', 'optimistic', 'positive', 'positive-affirmation', 'positive-life', 'positive-thinking', 'potential']",0
Let the improvement of yourself keep you so busy that you have no time to criticize others.,"Roy T. Bennett,","['improvement', 'inspiration', 'inspirational', 'inspirational-attitude', 'inspirational-life', 'inspirational-quotes', 'inspire', 'inspiring', 'leadership', 'learning', 'life', 'life-and-living', 'life-lessons', 'life-quotes', 'living', 'motivation', 'motivational', 'optimism', 'optimistic', 'positive', 'positive-affirmation', 'positive-life', 'positive-thinking', 'success']",0
Incredible change happens in your life when you decide to take control of what you do have power over instead of craving control over what you don't.,"Steve Maraboli,","['change', 'control', 'empowerment', 'inspirational', 'letting-go', 'life', 'motivational']",0
Believe in your infinite potential. Your only limitations are those you set upon yourself.,"Roy T. Bennett,","['believe', 'believe-in-yourself', 'confidence', 'empowerment', 'inspiration', 'inspirational', 'inspirational-quotes', 'inspire', 'inspiring', 'life', 'life-quotes', 'limitations', 'limits', 'living', 'motivation', 'motivational', 'optimism', 'optimistic', 'positive', 'positive-affirmation', 'positive-life', 'positive-thinking', 'potential', 'spiritual-growth', 'spirituality', 'talents']",0
"Happiness is not the absence of problems, it's the ability to deal with them.","Steve Maraboli,","['empowerment', 'happiness', 'inspirational', 'life-lessons', 'motivational', 'problems']",0
The only way of discovering the limits of the possible is to venture a little way past them into the impossible.,Arthur C. Clarke,['motivational'],0
"Surround Yourself with People Who Believe in Your Dreams:
Surround yourself with people who believe in your dreams, encourage your ideas, support your ambitions, and bring out the best in you.","Roy T. Bennett,","['ambition', 'dream', 'dreams', 'encourage', 'inspiration', 'inspirational', 'inspirational-quotes', 'inspire', 'inspiring', 'life', 'life-quotes', 'living', 'motivation', 'motivational', 'optimism', 'optimistic', 'positive', 'positive-affirmation', 'positive-life', 'positive-thinking']",0
"Learn the rules like a pro, so you can break them like an artist.",Pablo Picasso,"['art', 'creativity', 'motivational', 'picasso', 'rules', 'writing']",0
"Sometimes life knocks you on your ass... get up, get up, get up!!! Happiness is not the absence of problems, it's the ability to deal with them.","Steve Maraboli,","['ability', 'action', 'gratitude', 'happiness', 'inspirational', 'life', 'motivational', 'moving-forward', 'problems', 'success']",0
"Do what you love, love what you do, and with all your heart give yourself to it.","Roy T. Bennett,","['do', 'doing', 'heart', 'inspiration', 'inspirational', 'inspirational-attitude', 'inspirational-life', 'inspirational-quotes', 'inspire', 'inspiring', 'life', 'life-and-living', 'life-lessons', 'life-quotes', 'living', 'love', 'motivation', 'motivational', 'optimism', 'optimistic', 'positive', 'positive-affirmation', 'positive-life', 'positive-thinking']",0
"Once you realize you deserve a bright future, letting go of your dark past is the best choice you will ever make.","Roy T. Bennett,","['choice', 'future', 'inspiration', 'inspirational', 'inspirational-attitude', 'inspirational-life', 'inspirational-quotes', 'inspire', 'inspiring', 'letting-go', 'letting-go-and-moving-on', 'life', 'life-and-living', 'life-lessons', 'life-quotes', 'living', 'motivation', 'motivational', 'optimism', 'optimistic', 'positive', 'positive-affirmation', 'positive-life', 'positive-thinking']",0
Without ambition one starts nothing. Without work one finishes nothing. The prize will not be sent to you. You have to win it.,Ralph Waldo Emerson,"['motivational', 'work']",0
"If you believe very strongly in something, stand up and fight for it.","Roy T. Bennett,","['believe', 'believe-in-yourself', 'inspiration', 'inspirational', 'inspirational-attitude', 'inspirational-life', 'inspirational-quote', 'inspirational-quotes', 'inspire', 'inspiring', 'life', 'life-and-living', 'life-lessons', 'life-philosophy', 'life-quotes', 'living', 'motivation', 'motivational', 'optimism', 'optimistic', 'positive', 'positive-affirmation', 'positive-life', 'positive-thinking']",0
It's never too late to change your life for the better. You don't have to take huge steps to change your life. Making even the smallest changes to your daily routine can make a big difference to your life.,"Roy T. Bennett,","['change', 'inspiration', 'inspirational', 'inspirational-attitude', 'inspirational-life', 'inspirational-quotes', 'inspire', 'inspiring', 'life', 'life-and-living', 'life-lessons', 'life-quotes', 'living', 'motivation', 'motivational', 'optimism', 'optimistic', 'positive', 'positive-affirmation', 'positive-life', 'positive-thinking']",0
"Always remember people who have helped you along the way, and don’t forget to lift someone up.","Roy T. Bennett,","['gratitude', 'inspiration', 'inspirational', 'inspirational-attitude', 'inspirational-life', 'inspirational-quotes', 'inspire', 'inspiring', 'leader', 'leadership', 'life', 'life-and-living', 'life-lessons', 'life-quotes', 'living', 'motivation', 'motivational', 'optimism', 'optimistic', 'positive', 'positive-affirmation', 'positive-life', 'positive-thinking']",0
"The biggest wall you have to climb is the one you build in your mind: Never let your mind talk you out of your dreams, trick you into giving up. Never let your mind become the greatest obstacle to success. To get your mind on the right track, the rest will follow.","Roy T. Bennett,","['dream', 'dreams', 'dreams-quotes', 'inspiration', 'inspirational', 'inspirational-attitude', 'inspirational-life', 'inspirational-quotes', 'inspire', 'inspiring', 'life', 'life-and-living', 'life-lessons', 'life-quotes', 'living', 'mind', 'mind-quotes', 'motivation', 'motivational', 'obstacle', 'optimism', 'optimistic', 'positive', 'positive-affirmation', 'positive-life', 'positive-thinking', 'success', 'success-quotes']",0
"Maturity is when you stop complaining and making excuses, and start making changes.","Roy T. Bennett,","['change', 'choice', 'choices', 'excuse', 'inspiration', 'inspirational', 'inspirational-attitude', 'inspirational-life', 'inspirational-quotes', 'inspire', 'inspiring', 'life', 'life-and-living', 'life-lessons', 'life-quotes', 'living', 'motivation', 'motivational', 'optimism', 'optimistic', 'positive', 'positive-affirmation', 'positive-life', 'positive-thinking']",0
"When in a relationship, a real man doesn't make his woman jealous of others, he makes others jealous of his woman.","Steve Maraboli,","['boyfriend', 'girlfriend', 'inspirational', 'jealous', 'life', 'love', 'marriage', 'men', 'motivational', 'relationship', 'women']",0
What's done is done. What's gone is gone. One of life's lessons is always moving on. It’s okay to look back to see how far you’ve come but keep moving forward.,"Roy T. Bennett,","['inspiration', 'inspirational', 'inspirational-quotes', 'inspire', 'inspiring', 'keep-going', 'keep-moving-forward', 'life', 'life-quotes', 'living', 'motivation', 'motivational', 'optimism', 'optimistic', 'positive', 'positive-affirmation', 'positive-life', 'positive-thinking']",0
Strong people have a strong sense of self-worth and self-awareness; they don’t need the approval of others.,"Roy T. Bennett,","['inspiration', 'inspirational', 'inspirational-attitude', 'inspirational-life', 'inspirational-quotes', 'inspire', 'inspiring', 'life', 'life-and-living', 'life-lessons', 'life-quotes', 'living', 'motivation', 'motivational', 'optimism', 'optimistic', 'positive', 'positive-affirmation', 'positive-life', 'positive-thinking', 'self-awareness', 'self-worth', 'strong']",0
"Never stop dreaming,
never stop believing,
never give up,
never stop trying, and
never stop learning.","Roy T. Bennett,","['believe', 'inspiration', 'inspirational', 'inspirational-attitude', 'inspirational-life', 'inspirational-quotes', 'inspire', 'inspiring', 'learning', 'life', 'life-and-living', 'life-lessons', 'life-quotes', 'living', 'motivation', 'motivational', 'never-give-up', 'never-stop-believing', 'never-stop-dreaming', 'never-stop-learning', 'never-stop-trying', 'optimism', 'optimistic', 'positive', 'positive-affirmation', 'positive-life', 'positive-thinking', 'success']",0
"When the going gets tough, put one foot in front of the other and just keep going. Don’t give up.","Roy T. Bennett,","['adversity', 'challenge', 'inspiration', 'inspirational', 'inspirational-attitude', 'inspirational-life', 'inspirational-quotes', 'inspire', 'inspiring', 'keep-going', 'life', 'life-and-living', 'life-lessons', 'life-quotes', 'living', 'motivation', 'motivational', 'never-give-up', 'optimism', 'optimistic', 'persistence', 'positive', 'positive-affirmation', 'positive-life', 'positive-thinking']",0
"Stop giving other people the power to control your happiness, your mind, and your life. If you don't take control of yourself and your own life, someone else is bound to try.","Roy T. Bennett,","['happiness', 'inspiration', 'inspirational', 'inspirational-attitude', 'inspirational-life', 'inspirational-quotes', 'inspire', 'inspiring', 'life', 'life-and-living', 'life-lessons', 'life-quotes', 'living', 'mind', 'motivation', 'motivational', 'optimism', 'optimistic', 'positive', 'positive-affirmation', 'positive-life', 'positive-thinking']",0
"At the end of the day, let there be no excuses, no explanations, no regrets.","Steve Maraboli,","['appreciation', 'excuses', 'gratitude', 'inspirational', 'life', 'motivational', 'no-regrets', 'seize-the-day', 'success']",0
"We all make mistakes, have struggles, and even regret things in our past. But you are not your mistakes, you are not your struggles, and you are here NOW with the power to shape your day and your future.","Steve Maraboli,","['inspirational', 'life', 'living-now', 'mistakes', 'motivational', 'regret', 'self-empowerment', 'struggles']",0
"If you have a strong purpose in life, you don't have to be pushed. Your passion will drive you there.","Roy T. Bennett,","['inspirational', 'inspirational-attitude', 'inspirational-life', 'inspirational-quotes', 'inspire', 'inspiring', 'leadership', 'life', 'life-and-living', 'life-lessons', 'life-quotes', 'living', 'motivation', 'motivational', 'optimism', 'optimistic', 'passion', 'positive', 'positive-affirmation', 'positive-life', 'positive-thinking', 'purpose']",0
"Patience Is Not the Ability to Wait:
Patience is not the ability to wait. Patience is to be calm no matter what happens, constantly take action to turn it to positive growth opportunities, and have faith to believe that it will all work out in the end while you are waiting.","Roy T. Bennett,","['calm', 'faith', 'growth', 'inspiration', 'inspirational', 'inspirational-attitude', 'inspirational-life', 'inspirational-quotes', 'inspire', 'inspiring', 'life', 'life-and-living', 'life-lessons', 'life-quotes', 'living', 'motivation', 'motivational', 'opportunity', 'optimism', 'optimistic', 'patience', 'positive', 'positive-affirmation', 'positive-life', 'positive-thinking']",0
"Whatever the mind can conceive and believe, it can achieve.","Napoleon Hill,","['inspirational', 'motivational', 'success']",0
"Although the world is full of suffering, it is full also of the overcoming of it.",Helen Keller,['motivational'],0
"I will not try to convince you to love me, to respect me, to commit to me. I deserve better than that; I AM BETTER THAN THAT...Goodbye.","Steve Maraboli,","['breakup', 'commit', 'deserve', 'goodbye', 'happiness', 'inspirational', 'life', 'love', 'motivational', 'relationship', 'respect']",0
You must learn to let go. Release the stress. You were never in control anyway.,"Steve Maraboli,","['control', 'inspirational', 'letting-go', 'life', 'motivational', 'stress']",0
"However mean your life is, meet it and live it; do not shun it and call it hard names. It is not so bad as you are. It looks poorest when you are richest. The fault-finder will find faults even in paradise. Love your life, poor as it is. You may perhaps have some pleasant, thrilling, glorious hours, even in a poorhouse. The setting sun is reflected from the windows of the almshouse as brightly as from the rich man's abode; the snow melts before its door as early in the spring. I do not see but a quiet mind may live as contentedly there, and have as cheering thoughts, as in a palace.","Henry David Thoreau,","['inspirational', 'motivational']",0
"Make a pact with yourself today to not be defined by your past. Sometimes the greatest thing to come out of all your hard work isn't what you get for it, but what you become for it. Shake things up today! Be You...Be Free...Share.","Steve Maraboli,","['action', 'authenticity', 'gratitude', 'hard-work', 'inspirational', 'life', 'life-lessons', 'motivational', 'success']",0
"The strongest people find the courage and caring to help others, even if they are going through their own storm.","Roy T. Bennett,","['courage', 'inspiration', 'inspirational', 'inspirational-attitude', 'inspirational-life', 'inspirational-quotes', 'inspire', 'inspiring', 'life', 'life-and-living', 'life-lessons', 'life-quotes', 'living', 'motivation', 'motivational', 'optimism', 'optimistic', 'positive', 'positive-affirmation', 'positive-life', 'positive-thinking', 'strong']",0
The surest way to make your dreams come true is to live them.,Roy T. Bennett,"['dream', 'dream-comes-true', 'dreams', 'dreams-come-true', 'dreams-quotes', 'inspiration', 'inspirational', 'inspirational-quotes', 'inspire', 'inspiring', 'life', 'life-quotes', 'living', 'living-life', 'motivational', 'motivational-inspirational', 'positive-affirmation', 'positive-life', 'positive-thinking', 'positivity']",0
"Action may not always bring happiness, but there is no happiness without action.",William James,"['action', 'happiness', 'motivational', 'work']",0
Circumstances are the rulers of the weak; they are but the instruments of the wise.,"Samuel Lover,",['motivational'],0
"Courage is feeling fear, not getting rid of fear, and taking action in the face of fear.","Roy T. Bennett,","['courage', 'fear', 'fearless', 'inspiration', 'inspirational', 'inspirational-attitude', 'inspirational-life', 'inspirational-quotes', 'inspire', 'inspiring', 'life', 'life-and-living', 'life-lessons', 'life-quotes', 'living', 'motivation', 'motivational', 'optimism', 'optimistic', 'positive', 'positive-affirmation', 'positive-life', 'positive-thinking']",0
Do not let arrogance go to your head and despair to your heart; do not let compliments go to your head and criticisms to your heart; do not let success go to your head and failure to your heart.,"Roy T. Bennett,","['arrogance', 'compliment', 'criticism', 'despair', 'failure', 'heart', 'inspiration', 'inspirational', 'inspirational-attitude', 'inspirational-life', 'inspirational-quotes', 'inspire', 'inspiring', 'life', 'life-and-living', 'life-lessons', 'life-quotes', 'living', 'motivation', 'motivational', 'optimism', 'optimistic', 'positive', 'positive-affirmation', 'positive-life', 'positive-thinking', 'success']",0
"You cannot change anyone, but you can be the reason someone changes.","Roy T. Bennett,","['change', 'inspiration', 'inspirational', 'inspirational-attitude', 'inspirational-life', 'inspirational-quotes', 'inspire', 'inspiring', 'life', 'life-and-living', 'life-lessons', 'life-quotes', 'living', 'motivation', 'motivational', 'optimism', 'optimistic', 'positive', 'positive-affirmation', 'positive-life', 'positive-thinking']",0
