quote_text,author,tags,likes
"You are unique. You have different talents and abilities. You don’t have to always follow in the footsteps of others. And most important, you should always remind yourself that you don't have to do what everyone else is doing and have a responsibility to develop the talents you have been given.","Roy T. Bennett,","['ability', 'be-yourself', 'inspiration', 'inspirational', 'inspirational-attitude', 'inspirational-life', 'inspirational-quotes', 'inspire', 'inspiring', 'life', 'life-and-living', 'life-lessons', 'life-quotes', 'living', 'motivation', 'motivational', 'optimism', 'optimistic', 'positive', 'positive-affirmation', 'positive-life', 'positive-thinking', 'talent']",0
"Each day brings new opportunities, allowing you to constantly live with love—be there for others—bring a little light into someone's day. Be grateful and live each day to the fullest.","Roy T. Bennett,","['gratitude', 'inspiration', 'inspirational', 'inspirational-attitude', 'inspirational-life', 'inspirational-quotes', 'inspire', 'inspiring', 'life', 'life-and-living', 'life-lessons', 'life-quotes', 'light', 'live-life-to-the-fullest', 'living', 'love', 'motivation', 'motivational', 'optimism', 'optimistic', 'positive', 'positive-affirmation', 'positive-life', 'positive-thinking']",0
"Do not stop thinking of life as an adventure. You have no security unless you can live bravely, excitingly, imaginatively; unless you can choose a challenge instead of competence.","Eleanor Roosevelt,","['inspirational', 'motivational', 'women']",0
"If you hang out with chickens, you're going to cluck and if you hang out with eagles, you're going to fly.","Steve Maraboli,","['accountability', 'friends', 'inspirational', 'life', 'motivational', 'purpose', 'responsibility', 'success']",0
"To have what you have never had, you have to do what you have never done.","Roy T. Bennett,","['action', 'courage-quotes', 'courageous', 'doing', 'inspiration', 'inspirational', 'inspirational-quotes', 'inspire', 'inspiring', 'life', 'life-quotes', 'living', 'motivation', 'motivational', 'optimism', 'optimistic', 'positive', 'positive-affirmation', 'positive-life', 'positive-thinking']",0
"Live the Life of Your Dreams
When you start living the life of your dreams, there will always be obstacles, doubters, mistakes and setbacks along the way. But with hard work, perseverance and self-belief there is no limit to what you can achieve.","Roy T. Bennett,","['achievement', 'act', 'action', 'being-positive', 'belief', 'believe-in-yourself', 'do', 'doing', 'dreams', 'hard-work', 'inspiration', 'inspirational', 'life', 'live', 'living', 'living-life', 'mistakes', 'motivation', 'motivational', 'obstacles', 'optimism', 'optimistic', 'perseverance', 'positive', 'positive-affirmation', 'positive-life', 'positive-thinking', 'self-belief', 'setbacks', 'start', 'startup']",0
You are the average of the five people you spend the most time with.,Jim Rohn,"['motivational', 'reflective']",0
"People are always blaming their circumstances for what they are. I don't believe in circumstances. The people who get on in this world are the people who get up and look for the circumstances they want, and if they can't find them, make them.","George Bernard Shaw,","['motivational', 'overcoming-obstacles']",0
"You Are the Master of Your Attitude

You cannot control what happens to you, but you can control the way you think about all the events. You always have a choice. You can choose to face them with a positive mental attitude.","Roy T. Bennett,","['attitude', 'choice', 'choices', 'inspiration', 'inspirational', 'inspirational-attitude', 'inspirational-life', 'inspirational-quotes', 'inspire', 'inspiring', 'life', 'life-and-living', 'life-lessons', 'life-quotes', 'living', 'motivation', 'motivational', 'optimism', 'optimistic', 'positive', 'positive-affirmation', 'positive-life', 'positive-thinking']",0
"Get Off The Scale!

You are beautiful. Your beauty, just like your capacity for life, happiness, and success, is immeasurable. Day after day, countless people across the globe get on a scale in search of validation of beauty and social acceptance.

Get off the scale! I have yet to see a scale that can tell you how enchanting your eyes are. I have yet to see a scale that can show you how wonderful your hair looks when the sun shines its glorious rays on it. I have yet to see a scale that can thank you for your compassion, sense of humor, and contagious smile. Get off the scale because I have yet to see one that can admire you for your perseverance when challenged in life.

It’s true, the scale can only give you a numerical reflection of your relationship with gravity. That’s it. It cannot measure beauty, talent, purpose, life force, possibility, strength, or love. Don’t give the scale more power than it has earned. Take note of the number, then get off the scale and live your life. You are beautiful!","Steve Maraboli,","['beauty', 'inspirational', 'life', 'motivational', 'scale', 'self-empowerment', 'self-image', 'weight-loss']",0
"Renew, release, let go. Yesterday’s gone. There’s nothing you can do to bring it back. You can’t should’ve","Steve Maraboli,","['action', 'attachment', 'change', 'inspirational', 'letting-go', 'life', 'live-now', 'motivational', 'success', 'today']",0
"The most important step a man can take. It's not the first one, is it?
It's the next one. Always the next step, Dalinar.","Brandon Sanderson,","['inspirational', 'motivational']",0
How would your life be different if…You walked away from gossip and verbal defamation? Let today be the day…You speak only the good you know of other people and encourage others to do the same.,"Steve Maraboli,","['encouragement', 'friends', 'gossip', 'inspirational', 'life', 'motivational', 'relationships']",0
"LAW 4
Always Say Less Than Necessary

When you are trying to impress people with words, the more you say, the more common you appear, and the less in control. Even if you are saying something banal, it will seem original if you make it vague, open-ended, and sphinxlike. Powerful people impress and intimidate by saying less. The more you say, the more likely you are to say something foolish.","Robert Greene,","['inspirational', 'motivational']",0
"Forget yesterday - it has already forgotten you. Don't sweat tomorrow - you haven't even met. Instead, open your eyes and your heart to a truly precious gift - today.","Steve Maraboli,","['appreciation', 'change', 'gratitude', 'inspirational', 'life', 'live-now', 'motivational', 'success', 'today']",0
"Don’t let others tell you what you can’t do. Don't let the limitations of others limit your vision. If you can remove your self-doubt and believe in yourself, you can achieve what you never thought possible.","Roy T. Bennett,","['achievement', 'believe', 'believe-in-yourself', 'inspiration', 'inspirational', 'inspirational-attitude', 'inspirational-life', 'inspirational-quotes', 'inspire', 'inspiring', 'life', 'life-and-living', 'life-lessons', 'life-quotes', 'living', 'motivation', 'motivational', 'optimism', 'optimistic', 'positive', 'positive-affirmation', 'positive-life', 'positive-thinking', 'self-doubt', 'vision']",0
"You have to accept whatever comes, and the only important thing is that you meet it with the best you have to give.",Eleanor Roosevelt,['motivational'],0
Don't wish it were easier. Wish you were better.,Jim Rohn,"['hard-work', 'motivational']",0
"I want to live my life in such a way that when I get out of bed in the morning, the devil says, ""aw shit, he's up!","Steve Maraboli,","['aspirations', 'devil', 'goodness', 'inspirational', 'life', 'live', 'morning', 'motivational', 'purpose']",0
"Great leaders create more leaders, not followers.","Roy T. Bennett,","['inspiration', 'inspirational', 'inspirational-quotes', 'inspire', 'inspiring', 'leaders', 'leadership', 'life', 'life-quotes', 'living', 'motivation', 'motivational', 'optimism', 'optimistic']",0
"In the end, you have to choose whether or not to trust someone.","Sophie Kinsella,","['human-nature', 'inspirational', 'literature', 'motivational', 'trust']",0
"If you don’t give up on something you truly believe in, you will find a way.",Roy T. Bennett,"['believe', 'believe-in-yourself', 'don-t-give-up', 'inspiration', 'inspirational', 'inspirational-quotes', 'inspire', 'inspiring', 'life', 'life-quotes', 'living', 'motivation', 'motivational', 'never-give-up', 'optimism', 'optimistic', 'positive', 'positive-affirmation', 'positive-life', 'positive-thinking']",0
"Don't fear failure. — Not failure, but low aim, is the crime. In great attempts it is glorious even to fail.","Bruce Lee,","['fear', 'motivational']",0
"One of the most spiritual things you can do is embrace your humanity. Connect with those around you today. Say, ""I love you"", ""I'm sorry"", ""I appreciate you"", ""I'm proud of you""...whatever you're feeling. Send random texts, write a cute note, embrace your truth and share it...cause a smile today for someone else...and give plenty of hugs.",Steve Maraboli,"['action', 'compassion', 'humanity', 'inspirational', 'kindness', 'life', 'living-now', 'motivational', 'seize-the-day', 'spirituality', 'success']",0
Turn your obstacles into opportunities and your problems into possibilities.,"Roy T. Bennett,","['inspiration', 'inspirational', 'inspirational-attitude', 'inspirational-life', 'inspirational-quotes', 'inspire', 'inspiring', 'life', 'life-and-living', 'life-lessons', 'life-quotes', 'living', 'motivation', 'motivational', 'obstacle', 'opportunity', 'optimism', 'optimistic', 'positive', 'positive-affirmation', 'positive-life', 'positive-thinking', 'possibility', 'problem']",0
Rejection is an opportunity for your selection.,Bernard Branson,"['adult', 'african-american-romance', 'angels', 'baby', 'bible', 'bible-study', 'business', 'childrens', 'christian-living', 'christian-romance', 'college', 'creativity', 'dark-fantasy', 'dating', 'economics', 'education', 'educational', 'entrepreneurship', 'ethics', 'explicit', 'faith', 'family', 'family-relationships', 'fantasy-romance', 'friendship', 'fun', 'funny', 'humorous-romance', 'jesus', 'leadership', 'love-story', 'management', 'marriage', 'meditation', 'motivational', 'nonfiction', 'paranormal-romance', 'parenting', 'personal-transformation', 'relationships', 'religion', 'romantic-comedy', 'romantic-suspense', 'self-esteem', 'self-help', 'sex', 'sexuality', 'sexy', 'spiritual-growth', 'spirituality', 'students', 'success', 'supernatural', 'teen', 'women', 'young-adult', 'young-adult-fantasy']",0
"Remember to look up at the stars and not down at your feet. Try to make sense of what you see and wonder about what makes the universe exist. Be curious. And however difficult life may seem, there is always something you can do and succeed at.
It matters that you don't just give up.",Stephen Hawking,"['courage', 'curiosity', 'hopefulness', 'motivational', 'perseverance', 'universe', 'wonder']",0
Don't confuse poor decision-making with destiny. Own your mistakes. It’s ok; we all make them. Learn from them so they can empower you!,"Steve Maraboli,","['action', 'change', 'destiny', 'empowerment', 'inspirational', 'life', 'mistakes', 'motivational', 'success']",0
How would your life be different if…You stopped allowing other people to dilute or poison your day with their words or opinions? Let today be the day…You stand strong in the truth of your beauty and journey through your day without attachment to the validation of others.,"Steve Maraboli,","['choices', 'inspirational', 'life', 'motivational', 'opinions', 'self-empowerment', 'self-esteem', 'self-love']",0
"Never respond to an angry person with a fiery comeback, even if he deserves it...Don't allow his anger to become your anger.","Bohdi Sanders,","['anger', 'anger-management', 'ataraxy', 'bushido', 'inner-peace', 'inspirational', 'life', 'life-experience', 'life-lessons', 'martial-arts', 'motivational', 'self-control', 'serenity', 'warrior-ethos', 'warriors', 'warriorship', 'wisdom']",0
Be the positive impact on the lives of others.,Roy T. Bennett,"['inspiration', 'inspirational', 'inspirational-quotes', 'inspire', 'inspiring', 'life', 'life-quotes', 'living', 'motivation', 'motivational', 'optimism', 'optimistic', 'positive', 'positive-affirmation', 'positive-life', 'positive-thinking']",0
"Why Not You?

Today, many will awaken with a fresh sense of inspiration. Why not you?

Today, many will open their eyes to the beauty that surrounds them. Why not you?

Today, many will choose to leave the ghost of yesterday behind and seize the immeasurable power of today. Why not you?

Today, many will break through the barriers of the past by looking at the blessings of the present. Why not you?

Today, for many the burden of self doubt and insecurity will be lifted by the security and confidence of empowerment. Why not you?

Today, many will rise above their believed limitations and make contact with their powerful innate strength. Why not you?

Today, many will choose to live in such a manner that they will be a positive role model for their children. Why not you?

Today, many will choose to free themselves from the personal imprisonment of their bad habits. Why not you?

Today, many will choose to live free of conditions and rules governing their own happiness. Why not you?

Today, many will find abundance in simplicity. Why not you?

Today, many will be confronted by difficult moral choices and they will choose to do what is right instead of what is beneficial. Why not you?

Today, many will decide to no longer sit back with a victim mentality, but to take charge of their lives and make positive changes. Why not you?

Today, many will take the action necessary to make a difference. Why not you?

Today, many will make the commitment to be a better mother, father, son, daughter, student, teacher, worker, boss, brother, sister, & so much more. Why not you?

Today is a new day!

Many will seize this day.

Many will live it to the fullest.

Why not you?","Steve Maraboli,","['happiness', 'inspirational', 'inspirational-poem', 'life', 'motivational', 'seize-the-day']",0
Dreams don't work unless you take action. The surest way to make your dreams come true is to live them.,Roy T. Bennett,"['action', 'do', 'dream', 'dream-comes-true', 'dreams', 'dreams-come-true', 'dreams-quotes', 'inspiration', 'inspirational', 'inspirational-quotes', 'inspire', 'inspiring', 'life', 'life-quotes', 'living', 'living-life', 'motivational', 'motivational-inspirational', 'positive-affirmation', 'positive-life', 'positive-thinking', 'positivity', 'take-action', 'take-actions']",0
It takes sunshine and rain to make a rainbow. There would be no rainbows without sunshine and rain.,"Roy T. Bennett,","['inspiration', 'inspirational', 'inspirational-attitude', 'inspirational-life', 'inspirational-quotes', 'inspire', 'inspiring', 'life', 'life-and-living', 'life-lessons', 'life-quotes', 'living', 'motivation', 'motivational', 'optimism', 'optimistic', 'positive', 'positive-affirmation', 'positive-life', 'positive-thinking', 'rainbow', 'rainbows']",0
"Let today be the day you stop being haunted by the ghost of yesterday. Holding a grudge & harboring anger/resentment is poison to the soul. Get even with people...but not those who have hurt us, forget them, instead get even with those who have helped us.","Steve Maraboli,","['action', 'anger', 'change', 'grudges', 'inspirational', 'life', 'living-in-the-present', 'motivational', 'poison', 'resentment', 'seize-the-day', 'soul', 'success']",0
"First say to yourself what you would be;
and then do what you have to do.",Epictetus,['motivational'],0
"Want to keep Christ in Christmas? Feed the hungry, clothe the naked, forgive the guilty, welcome the unwanted, care for the ill, love your enemies, and do unto others as you would have done unto you.","Steve Maraboli,","['care', 'christ', 'christianity', 'christmas', 'clothe', 'enemies', 'feed', 'forgive', 'golden-rule', 'guilty', 'hungry', 'ill', 'inspirational', 'jesus', 'life', 'love', 'motivational', 'naked', 'service', 'unwanted', 'welcome']",0
It doesn’t matter how many times you get knocked down. All that matters is you get up one more time than you were knocked down.,Roy T. Bennett,"['ability', 'don-t-give-up', 'inspiration', 'inspirational', 'inspirational-quotes', 'inspire', 'inspiring', 'leader', 'leaders', 'leadership', 'life', 'life-quotes', 'living', 'motivation', 'motivational', 'never-give-up', 'optimism', 'optimistic', 'perseverance', 'persistence', 'positive', 'positive-affirmation', 'positive-life', 'positive-thinking', 'vision']",0
I cannot let the fear of the past color the future.,"Julie Kagawa,",['motivational'],0
"Failure is a bend in the road, not the end of the road. Learn from failure and keep moving forward.",Roy T. Bennett,"['change', 'failure', 'failures', 'inspiration', 'inspirational', 'inspirational-quotes', 'inspire', 'inspiring', 'keep-going', 'keep-moving-forward', 'learn', 'learning', 'life', 'life-quotes', 'living', 'motivation', 'motivational', 'optimism', 'optimistic', 'perseverance', 'positive', 'positive-affirmation', 'positive-life', 'positive-thinking', 'risk', 'success']",0
It doesn't matter what you did or where you were...it matters where you are and what you're doing. Get out there! Sing the song in your heart and NEVER let anyone shut you up!!,"Steve Maraboli,","['action', 'change', 'gratitude', 'inspiration', 'life', 'motivational', 'purpose', 'seize-the-day']",0
"It takes guts and humility to admit mistakes. Admitting we're wrong is courage, not weakness.","Roy T. Bennett,","['courage', 'inspiration', 'inspirational', 'inspirational-attitude', 'inspirational-life', 'inspirational-quotes', 'inspire', 'inspiring', 'life', 'life-and-living', 'life-lessons', 'life-quotes', 'living', 'mistakes', 'motivation', 'motivational', 'optimism', 'optimistic', 'positive', 'positive-affirmation', 'positive-life', 'positive-thinking']",0
Discipline Your Mind to Think Positively: Discipline your mind to see the good in every situation and look on the best side of every event.,"Roy T. Bennett,","['inspiration', 'inspirational', 'inspirational-attitude', 'inspirational-life', 'inspirational-quotes', 'inspire', 'inspiring', 'life', 'life-and-living', 'life-lessons', 'life-quotes', 'living', 'motivation', 'motivational', 'optimism', 'optimistic', 'positive', 'positive-affirmation', 'positive-life', 'positive-thinking']",0
"Time is an equal opportunity employer. Each human being has exactly the same number of hours and minutes every day. Rich people can't buy more hours. Scientists can't invent new minutes. And you can't save time to spend it on another day. Even so, time is amazingly fair and forgiving. No matter how much time you've wasted in the past, you still have an entire tomorrow.",Denis Waitley,"['motivational', 'procrastination', 'time']",0
The one who falls and gets up is stronger than the one who never tried. Do not fear failure but rather fear not trying.,"Roy T. Bennett,","['failure', 'fearless', 'inspiration', 'inspirational', 'inspirational-attitude', 'inspirational-life', 'inspirational-quote', 'inspirational-quotes', 'inspire', 'inspiring', 'life', 'life-and-living', 'life-lessons', 'life-philosophy', 'life-quotes', 'living', 'motivation', 'motivational', 'never-give-up', 'optimism', 'optimistic', 'persistence', 'positive', 'positive-affirmation', 'positive-life', 'positive-thinking', 'strong', 'trying']",0
"It’s important that what thoughts you are feeding into your mind because your thoughts create your belief and experiences. You have positive thoughts and you have negative ones too. Nurture your mind with positive thoughts: kindness, empathy, compassion, peace, love, joy, humility, generosity, etc. The more you feed your mind with positive thoughts, the more you can attract great things into your life.","Roy T. Bennett,","['belief', 'compassion', 'empathy', 'experiences', 'generosity', 'humility', 'inspiration', 'inspirational', 'inspirational-quotes', 'inspire', 'inspiring', 'joy', 'kindness', 'life', 'life-quotes', 'living', 'love', 'mind', 'motivation', 'motivational', 'optimism', 'optimistic', 'peace', 'positive', 'positive-affirmation', 'positive-life', 'positive-thinking', 'thoughts']",0
What you stay focused on will grow.,Roy T. Bennett,"['focus', 'grow', 'inspiration', 'inspirational', 'inspirational-quotes', 'inspire', 'inspiring', 'leader', 'leaders', 'leadership', 'life', 'life-quotes', 'living', 'motivation', 'motivational', 'optimism', 'optimistic', 'positive', 'positive-affirmation', 'positive-life', 'positive-thinking', 'stay-focused']",0
"When things do not go your way, remember that every challenge — every adversity — contains within it the seeds of opportunity and growth.",Roy T. Bennett,"['adversity', 'challenge', 'growth', 'inspiration', 'inspirational', 'inspirational-quotes', 'inspire', 'inspiring', 'life', 'life-quotes', 'living', 'motivation', 'motivational', 'opportunity', 'optimism', 'optimistic', 'positive', 'positive-affirmation', 'positive-life', 'positive-thinking']",0
Don’t wait for things to happen. Make them happen.,Roy T. Bennett,"['act', 'action', 'inspiration', 'inspirational', 'inspirational-attitude', 'inspirational-life', 'inspirational-quotes', 'inspire', 'inspiring', 'life', 'life-and-living', 'life-lessons', 'life-quotes', 'living', 'motivation', 'motivational', 'optimism', 'optimistic', 'positive', 'positive-affirmation', 'positive-life', 'positive-thinking']",0
"Be silent and safe — silence never betrays you;
Be true to your word and your work and your friend;
Put least trust in him who is foremost to praise you,
Nor judge of a road till it draw to the end.","John Boyle O'Reilly,","['advice', 'friends', 'inspirational', 'judgement', 'motivational', 'poetry', 'praise', 'safety', 'silence', 'true', 'trust', 'work']",0
"You learn something valuable from all of the significant events and people, but you never touch your true potential until you challenge yourself to go beyond imposed limitations.",Roy T. Bennett,"['challenge', 'growth', 'inspiration', 'inspirational', 'inspirational-quotes', 'inspire', 'inspiring', 'learn', 'learning', 'life', 'life-quotes', 'living', 'motivation', 'motivational', 'optimism', 'optimistic', 'positive', 'positive-affirmation', 'positive-life', 'positive-thinking', 'potential']",0
"Challenge and adversity are meant to help you know who you are. Storms hit your weakness, but unlock your true strength.","Roy T. Bennett,","['adversity', 'challenge', 'inspiration', 'inspirational', 'inspirational-attitude', 'inspirational-life', 'inspirational-quotes', 'inspire', 'inspiring', 'life', 'life-and-living', 'life-lessons', 'life-quotes', 'living', 'motivation', 'motivational', 'optimism', 'optimistic', 'positive', 'positive-affirmation', 'positive-life', 'positive-thinking', 'potential']",0
"This life is for loving, sharing, learning, smiling, caring, forgiving, laughing, hugging, helping, dancing, wondering, healing, and even more loving. I choose to live life this way. I want to live my life in such a way that when I get out of bed in the morning, the devil says, 'aw shit, he's up!","Steve Maraboli,","['caring', 'dancing', 'devil', 'forgiving', 'healing', 'helping', 'hugging', 'inspirational', 'laughing', 'learning', 'life', 'loving', 'loving-choices', 'motivational', 'sharing', 'smiling', 'wondering']",0
"You were put on this earth to achieve your greatest self, to live out your purpose, and to do it courageously.","Steve Maraboli,","['fearless', 'greatness', 'inspirational', 'life', 'motivational', 'purpose-of-life', 'self-empowerment', 'success']",0
"You were born to stand out, stop trying to fit in.","Roy T. Bennett,","['authentic-living', 'be-yourself', 'inspiration', 'inspirational', 'inspirational-attitude', 'inspirational-life', 'inspirational-quote', 'inspirational-quotes', 'inspire', 'inspiring', 'life', 'life-and-living', 'life-lessons', 'life-philosophy', 'life-quotes', 'living', 'motivation', 'motivational', 'optimism', 'optimistic', 'positive', 'positive-affirmation', 'positive-life', 'positive-thinking']",0
The universe doesn’t give you what you ask for with your thoughts - it gives you what you demand with your actions.,"Steve Maraboli,","['actions', 'change', 'inspirational', 'intent', 'motivational', 'success', 'thoughts', 'universe']",0
Stop doing what is easy. Start doing what is right.,"Roy T. Bennett,","['act', 'action', 'do', 'doing', 'inspiration', 'inspirational', 'inspirational-quotes', 'inspire', 'inspiring', 'life', 'life-quotes', 'living', 'motivation', 'motivational', 'optimism', 'optimistic', 'positive', 'positive-affirmation', 'positive-life', 'positive-thinking', 'right', 'start', 'startup', 'truth']",0
"Changing your outside world cannot make you happy if you are an unhappy person. The real personal change can only happen from the inside out. If you firstly create the change within yourself, you can turn your life around.","Roy T. Bennett,","['change', 'happiness', 'inspiration', 'inspirational', 'inspirational-attitude', 'inspirational-life', 'inspirational-quotes', 'inspire', 'inspiring', 'life', 'life-and-living', 'life-lessons', 'life-quotes', 'living', 'motivation', 'motivational', 'optimism', 'optimistic', 'positive', 'positive-affirmation', 'positive-life', 'positive-thinking']",0
